[
  {
    "id": 1,
    "title": "54rt",
    "content_file": "content/news/2025-08-22-54rt.md",
    "date": "2025-08-22",
    "author": "Admin"
  },
  {
    "id": 2,
    "title": "Masuratori Baliza",
    "content_file": "content/news/2025-08-22-masuratori-baliza.md",
    "date": "2025-08-22",
    "author": "Florin Miron"
  }
]